address,longitude,latitude
"大阪府豊中市本町４－１－２２第１５千里ビル２０４",135.46410271,34.78966422
"大阪府豊中市豊南町西３－３－１司マンション１０５号",135.48293525,34.75333798
"大阪府豊中市庄内幸町１－９－１６",135.46796705,34.75262954
"大阪府豊中市庄内幸町２－１２－４",135.46912531,34.75095474
"大阪府豊中市夕日丘１－３－１２",135.47742956,34.78321785
"大阪府豊中市中桜塚２－２－２",135.46757209,34.77989591
"大阪府豊中市中桜塚２－２５－９",135.46879699,34.78001813
"大阪府豊中市中桜塚５－２０－３８",135.47601861,34.78094588
"大阪府豊中市岡町６－１７",135.46561388,34.78103743
"大阪府箕面市船場東２－５－４７ＣＯＭ３号館４階",135.49177733,34.82355534
"大阪府箕面市半町４－１－２７",135.46058021,34.81368647
"大阪府吹田市豊津町１－２１エサカ中央ビル５階",135.49668114,34.76016797
"大阪府吹田市広芝町１０－４０（ＴＥＫ第１ビル３階）",135.49777275,34.75732388
"大阪府吹田市江坂町４－１０－１",135.49625049,34.76781154
"大阪府吹田市片山町３－３７－３",135.52308411,34.76774813
"大阪府吹田市佐井寺４－１１－１６",135.51480970,34.78381275
"大阪府吹田市上山手町２１－２８",135.51810949,34.77611369
"大阪府摂津市千里丘東２－１２－１０",135.55377278,34.79067947
"大阪府茨木市永代町７－１０川崎ビル２階",135.57497578,34.81794121
"大阪府茨木市大池１－１０－３７",135.57727017,34.81197242
"大阪府茨木市双葉町８－１９",135.57719787,34.81630808
"大阪府高槻市西冠１－１２－８たかつき西冠ビル１階",135.62133257,34.83364009
"大阪府高槻市宮野町３－１２サニープラザ南館",135.63820590,34.85272707
"大阪府高槻市東五百住町３－７－２０",135.60014261,34.83730880
"大阪府高槻市富田町６－１０－１",135.59439351,34.82876513
"大阪府高槻市宮田町２－５－２８",135.59154048,34.84269690
"大阪府守口市菊水通３－２－５",135.57804674,34.72979298
"大阪府守口市西郷通１－１５－１８",135.57241655,34.73276476
"大阪府守口市大枝北町１０－３",135.56731416,34.73393397
"大阪府門真市岸和田３－１－２６",135.61789857,34.72811881
"大阪府門真市新橋町２－１２",135.58513482,34.73764221
"大阪府門真市城垣町２－３３",135.61340980,34.74184218
"大阪府寝屋川市成田町２５－２",135.63977050,34.78133796
"大阪府寝屋川市三井南町２０－１７",135.63841512,34.77480818
"大阪府寝屋川市大利町２１－２寝屋川大利メディカルガーデンズ３Ｆ",135.61746142,34.76513694
"大阪府寝屋川市仁和寺本町３－９－６",135.59973527,34.76628097
"大阪府寝屋川市八坂町１５－８中川ビル２Ｆ",135.62172218,34.76457038
"大阪府寝屋川市打上高塚町３－１０",135.64966732,34.75605768
"大阪府枚方市大垣内町１－１－５",135.65018597,34.81402328
"大阪府枚方市山之上西町３２－１５",135.64504220,34.80197719
"大阪府枚方市楠葉中町４４－２３",135.68134577,34.86796001
"大阪府枚方市新町１－７－７",135.64748617,34.81704233
"大阪府大東市北条１－５－３０",135.63992180,34.71930345
"大阪府大東市北条２－９－１８",135.64227698,34.72653876
"大阪府大東市御供田５－６－２３",135.63213951,34.70468829
"大阪府大東市赤井１－３－２３シャンテ三船Ⅲ１階",135.62079598,34.70812110
"大阪府四條畷市楠公１－１４－６梨岡ハイツ１階",135.63886325,34.73229085
"大阪府四條畷市楠公２－１０－１２",135.64024924,34.73224920
"大阪府交野市私部西２－６－１メディカルテラスかたの１Ｆ",135.67459233,34.78446597
"大阪府交野市梅が枝４４－３",135.67099542,34.79144846
"大阪府東大阪市長田中１－１－５",135.58803004,34.67796276
"大阪府東大阪市御厨南１－１－１２ユニティハウス１階",135.58841911,34.66531697
"大阪府東大阪市高井田元町１－３－１",135.57263990,34.66476669
"大阪府東大阪市長堂１－２－５",135.56219355,34.66476370
"大阪府東大阪市森河内西２－２０－１９",135.56919271,34.68717800
"大阪府東大阪市菱屋西２－７－１６",135.57805914,34.65202102
"大阪府東大阪市菱屋西３－４－３２",135.57881720,34.66194770
"大阪府東大阪市大蓮東３－３－３",135.58154805,34.63680056
"大阪府東大阪市松原１－１６－３４",135.62684067,34.67409167
"大阪府東大阪市島之内２－１２－３",135.61963839,34.67948539
"大阪府東大阪市日下町３－５－３０",135.64530537,34.69155931
"大阪府松原市天美東６－１８－３７",135.53445077,34.58920488
"大阪府松原市阿保３－８－２１",135.55370492,34.57798975
"大阪府八尾市太田３－５９",135.59079567,34.59018635
"大阪府八尾市光町１－７",135.60369063,34.63388194
"大阪府八尾市桂町６－１８－１",135.61264797,34.64573082
"大阪府藤井寺市道明寺２－５－２５",135.61826048,34.56727822
"大阪府藤井寺市藤ケ丘１－１２－１６",135.60097041,34.56513090
"大阪府藤井寺市藤ヶ丘３－１３－１６",135.60005391,34.56159793
"大阪府富田林市若松町西１－１８４５－３",135.60269071,34.50634842
"大阪府富田林市寿町２－３－２",135.59540808,34.50119339
"大阪府河内長野市木戸西町２－１－１６",135.56444185,34.46730234
"大阪府河内長野市西之山町１－２２",135.56404214,34.45508711
"大阪府河内長野市三日市町５６－１６高岸ビル３Ｆ",135.57090023,34.43729193
"大阪府堺市美原区大保１６－１",135.56106603,34.54826817
"大阪府大阪狭山市西山台３－１５－８",135.54304640,34.48358621
"大阪府大阪狭山市西山台３－５－２０",135.54380185,34.48542768
"大阪府堺市堺区東雲西町１－１－１１ＪＲ堺市駅ＮＫビル１階",135.49820153,34.57737246
"大阪府堺市堺区三国ケ丘御幸通５９高島屋堺店内５階",135.48476945,34.57602245
"大阪府堺市堺区一条通１５－２５",135.48155319,34.57085348
"大阪府堺市堺区中安井町２－１－１",135.47662858,34.57188383
"大阪府堺市南区晴美台２－３５－１０",135.52280375,34.48764655
"大阪府堺市堺区熊野町西３－２－３",135.47174266,34.58064116
"大阪府堺市北区東浅香山町２丁３４８－１",135.50868375,34.58341074
"大阪府堺市北区百舌鳥梅町３丁１－６",135.50307394,34.55269198
"大阪府堺市西区堀上緑町２－２－１",135.48148460,34.53468813
"大阪府堺市西区津久野町３－２７－５０",135.46745793,34.54350073
"大阪府和泉市鶴山台１－２４－６",135.45378466,34.50956264
"大阪府和泉市伏屋町３－２７－７",135.46750045,34.48152727
"大阪府和泉市いぶき野５－１－２ＰＩＶＯ和泉中央２Ｆ",135.45730729,34.46083793
"大阪府和泉市府中町７－５－３",135.42635416,34.48972565
"大阪府和泉市和気町３－１１－１８",135.42571270,34.47753824
"大阪府和泉市青葉台２－１９－２",135.46657617,34.44189023
"大阪府泉大津市森町１－３－２５",135.42658434,34.50982328
"大阪府泉大津市森町２－３－８",135.42452619,34.51015931
"大阪府泉大津市助松団地３－１１",135.42925906,34.51162311
"大阪府泉大津市上之町６－２３",135.39845941,34.49955743
"大阪府泉大津市上之町７－３４",135.39931487,34.50094339
"大阪府泉北郡忠岡町忠岡東１－３９－２９",135.40083154,34.48639508
"大阪府岸和田市加守町２－７－５",135.38461639,34.47201595
"大阪府岸和田市上野町西１１－２１",135.38119450,34.46880515
"大阪府岸和田市上町３６－１０",135.37860045,34.45493177
"大阪府貝塚市近木２０－２４",135.35609162,34.44724058
"大阪府貝塚市畠中１－２－５",135.35746105,34.43964710
"大阪府貝塚市水間２４４",135.38638400,34.40324639
"大阪府泉佐野市りんくう往来北１りんくうゲートタワービル１７階",135.29986430,34.41133539
"大阪府泉佐野市りんくう往来北１りんくうゲートタワービル８階",135.29986430,34.41133539
"大阪府泉南郡岬町多奈川谷川２５９９－１",135.12658437,34.31577146
"大阪府堺市東区西野４９２－２",135.54102674,34.52131519
"大阪府堺市中区深井沢町３２８７辻尾ビル３階",135.49712772,34.52939153
"大阪府堺市中区土師町３－２６－２６",135.49719698,34.54004323
"大阪府堺市中区福田５４０－５",135.52256728,34.52144259
"京都府京都市下京区仏光寺通柳馬場西入東前町３９８",135.76300474,35.00127564
"京都府京都市下京区七条通河原町東入材木町４６０",135.76448831,34.98969885
"京都府京都市下京区烏丸通塩小路下ル東塩小路町９０１ホテルグランヴィア京都３Ｆ",135.75801969,34.98567964
"京都府京都市下京区七条通油小路東入大黒町２５３",135.75508647,34.98893767
"京都府京都市下京区油小路通下魚ノ棚下る油小路町２７７番地",135.75395882,34.98800440
"京都府京都市下京区東中筋通花屋町下ル柳町３３２",135.75428644,34.99198187
"京都府京都市下京区観喜寺町１０－１５",135.74432346,34.98901532
"京都府京都市伏見区小栗栖森本町５１",135.79821206,34.94381836
"京都府京都市南区久世大薮町１９６－１",135.72146918,34.95842594
"京都府京都市南区吉祥院里ノ内町８３",135.73238266,34.97240545
"京都府京都市南区唐橋堂ノ前町２３－１洛南スクエアビル２階",135.73781568,34.97870777
"京都府京都市南区四ツ塚町１",135.74600403,34.97956889
"京都府京都市北区衣笠北荒見町９－１イーグルコート北大路アネックス１０１号",135.73629277,35.04027450
"京都府京都市北区大北山原谷乾町２０７－３",135.71926927,35.04604847
"京都府京都市中京区釜座通竹屋町下ル亀屋町３３５",135.75596332,35.01551611
"京都府京都市中京区河原町夷川上ル指物３３４－２",135.76874268,35.01463843
"京都府京都市中京区三条通高倉東入桝屋町５８番地・５６番地",135.76283507,35.00841950
"京都府京都市中京区高倉通三条下る丸屋町１６６－６",135.76282676,35.00779733
"京都府京都市中京区虎屋町５７７番地２太陽生命御池ビル７・８・９Ｆ",135.75984920,35.01008325
"京都府京都市中京区西ノ京東栂尾町３ＪＲ二条駅ＮＫビル３Ｆ",135.74205924,35.01131350
"京都府京都市中京区西ノ京中保町１８",135.73129065,35.02123465
"京都府京都市中京区西ノ京北壺井町６７",135.72931036,35.01529073
"京都府京都市東山区松原通大和大路東入弓矢町４８",135.77247329,34.99852873
"京都府京都市左京区岩倉北池田町６７－４",135.77489446,35.06520514
"京都府京都市左京区下鴨本町１２－４",135.77123465,35.04422956
"京都府京都市左京区北白川堂ノ前町３６",135.79130989,35.03304227
"京都府京都市山科区四ノ宮泓３－４",135.82498185,34.98983082
"京都府京都市山科区御陵四丁野町６５－２",135.81250803,34.98899167
"京都府城陽市久世下大谷１８－１１１",135.78176180,34.86936726
"京都府城陽市枇杷庄鹿背田３７－９",135.77334658,34.83903423
"京都府京田辺市興戸南落延２３",135.78075462,34.80770109
"京都府宇治市神明宮北３２",135.78775529,34.87857178
"京都府京都市伏見区深草大亀谷万帖敷町９０",135.77882510,34.94575082
"京都府京都市伏見区京町４－１６５",135.76459823,34.93345437
"京都府京都市伏見区銀座３－３１８",135.76387614,34.93601517
"京都府京都市伏見区深草下川原町５１－５",135.76247207,34.96538177
"京都府京都市伏見区深草フチ町１４－２",135.76075546,34.95528840
"京都府八幡市欽明台北５",135.71553509,34.84108881
"京都府八幡市欽明台西２０－６",135.71763248,34.83495635
"京都府八幡市橋本栗ケ谷２６－１５５",135.68768388,34.88046700
"京都府八幡市男山長沢１８－９",135.69333903,34.86571424
"京都府京都市右京区西京極佃田町１７",135.72702201,34.98890963
"京都府京都市西京区桂南巽町１４６グラシューズ桂３Ｆ",135.70068804,34.97970759
"京都府京都市右京区花園伊町６",135.71907507,35.02066227
"京都府京都市右京区花園木辻南町２８－２",135.72324140,35.01987352
"京都府京都市右京区御室芝橋町６－１９",135.71288385,35.02652821
"京都府京都市右京区嵯峨野開町２１",135.69673793,35.01458496
"京都府京都市右京区嵯峨野神ノ木町１０－１０",135.69474356,35.01622922
"京都府向日市寺戸町向畑５７－３",135.70090412,34.95325154
"京都府向日市寺戸町殿長１９－１",135.70313164,34.95107118
"京都府向日市上植野町円山１２－５",135.70347574,34.93896129
"京都府長岡京市一文橋２－３１－１",135.70047870,34.93380073
"京都府長岡京市馬場見場走り２５－３",135.70842780,34.92689051
"京都府木津川市州見台７－１－２８",135.82091436,34.71560278
"京都府木津川市城山台７－４３－３",135.83243490,34.73354280
"京都府木津川市木津川台７－１－３",135.78338879,34.74154646
"京都府福知山市字内記４１－６",135.12755173,35.29775794
"京都府福知山市長山町４５９－９９",135.17110344,35.29411784
"京都府亀岡市河原町１９２",135.57257272,35.02045470
"京都府与謝郡与謝野町字弓木１５２８－２",135.14817238,35.56226971
"奈良県生駒市東生駒４－３９８－１６６",135.71805467,34.68016362
"奈良県生駒市東松ケ丘１７－８",135.69785827,34.69960338
"奈良県生駒市本町７－１０",135.69736972,34.69129871
"奈良県奈良市四条大路１－７－１９",135.80390558,34.68003990
"奈良県奈良市尼辻中町１１－３",135.78402933,34.68163941
"奈良県奈良市赤膚町１０３２",135.76553931,34.67283732
"奈良県奈良市六条２－１９－８",135.77339426,34.67195417
"奈良県奈良市芝辻町１－９－５",135.81893196,34.68659774
"奈良県奈良市大宮町４－２４１－１",135.81114937,34.68265359
"奈良県奈良市元興寺町３２",135.83085627,34.67590470
"奈良県奈良市南城戸町６７",135.82742595,34.67776000
"奈良県奈良市中登美ケ丘１－１９９４－３　Ｄ１６－１",135.74996763,34.71813206
"奈良県奈良市中山町西４－４５６－１学園前Ｔ．Ｓビル１０１号",135.75846427,34.71056076
"奈良県奈良市鶴舞東町２－２６",135.75244546,34.70861372
"奈良県奈良市学園南１－１－１７",135.75170690,34.69658455
"奈良県奈良市学園南３－４－２４",135.75134588,34.69254889
"奈良県奈良市学園大和町５－１１７",135.74244680,34.68826868
"奈良県奈良市富雄北２－１－４中里ビル１Ｆ",135.73593069,34.69477351
"奈良県奈良市右京３－１９－１",135.78868106,34.72004321
"奈良県奈良市菅原町６４８－１",135.77253016,34.68567494
"奈良県桜井市西之宮２２８－３５",135.82371166,34.51375012
"奈良県橿原市白橿町２－３１－１２",135.79060703,34.47451579
"奈良県橿原市八木町２－２－１８",135.79553636,34.50848364
"奈良県橿原市上品寺町３８０－２２",135.79540022,34.52175695
"奈良県橿原市内膳町１－１－１１Ｕ遊タウンビル１階",135.79341429,34.51238865
"奈良県橿原市内膳町２－１－３０",135.79054790,34.51062495
"奈良県橿原市曽我町８４９－３",135.77739906,34.51543802
"奈良県北葛城郡広陵町萱野６７７－１",135.75134832,34.56682570
"奈良県磯城郡川西町唐院４３－１",135.76258592,34.58315193
"奈良県五條市中之町１６１７－１",135.67904696,34.36746085
"奈良県北葛城郡上牧町大字上牧３３３６－５",135.71791762,34.56360587
"奈良県大和郡山市九条町１３１１－１",135.78342163,34.65836677
"奈良県大和郡山市今国府町１８３－１",135.76839293,34.61905371
"奈良県大和郡山市額田部北町４７９－３",135.77959227,34.60710269
"奈良県大和郡山市野垣内町２－２第７号棟第１２１号室",135.79014355,34.65033711
"奈良県大和郡山市高田町９２－１４ハーベス２Ｆ",135.79120182,34.64765130
"奈良県葛城市新庄１６",135.72027462,34.48705996
"和歌山県紀の川市貴志川町長山２７７－２１４",135.28912098,34.20871860
"和歌山県和歌山市鷹匠町１－６０",135.17797659,34.22336712
"和歌山県和歌山市小松原通１－１－１１大岩ビル３Ｆ",135.16861067,34.22521119
"和歌山県和歌山市津秦４０",135.20432478,34.22289284
"和歌山県和歌山市有家２４９－１６",135.19729189,34.22448417
"和歌山県和歌山市木広町５－１－１２",135.19019233,34.22662819
"和歌山県和歌山市市小路４０２",135.16740735,34.25524164
"和歌山県和歌山市直川１－８",135.20880998,34.26110335
"和歌山県和歌山市毛見２９５－２１",135.19941217,34.16884398
"和歌山県和歌山市毛見３４２－１２",135.20030374,34.17017714
"和歌山県海南市名高１４０－１",135.22001032,34.15368851
"和歌山県海南市名高５３９－１８岩崎ビル１Ｆ",135.21200554,34.15520749
"和歌山県御坊市湯川町財部６４６－１１",135.15121610,33.89805485
"和歌山県御坊市湯川町財部７１５",135.15256878,33.89628563
"和歌山県御坊市湯川町小松原３８０－１１",135.16021520,33.90642361
"和歌山県日高郡美浜町田井３１３－１",135.14848027,33.89256651
"和歌山県日高郡美浜町和田１１３８－１０４",135.13375641,33.89479942
"和歌山県橋本市三石台１－３－１１フォレストＢ棟１０２号",135.60214260,34.35567537
"和歌山県橋本市御幸辻２１８－３",135.60532877,34.34011898
"和歌山県海南市下津町下津７８５－２",135.14534297,34.10948370
"和歌山県日高郡印南町島田１１６３－１１",135.24083303,33.79672804
"和歌山県岩出市西野１９０－１",135.31070659,34.25707180
"和歌山県紀の川市上野１３－１０",135.36324020,34.25964461
"和歌山県紀の川市上野７８－１",135.36228470,34.26197211
"兵庫県神戸市中央区三宮町１－１０－１神戸交通センタービル７Ｆ",135.19387487,34.69326270
"兵庫県神戸市中央区三宮町１－４－４木口ビル３階",135.19295276,34.69084907
"兵庫県神戸市中央区海岸通４新明海ビル４階",135.18467857,34.68545239
"兵庫県神戸市中央区西町３３－２",135.19039470,34.68775773
"兵庫県神戸市中央区東川崎町１－７－４ダイヤニッセイビル７階",135.18162895,34.67960579
"兵庫県神戸市中央区野崎通４－１－２",135.20631514,34.70877503
"兵庫県神戸市中央区脇浜海岸通２－２－３　ケーズデンキ３Ｆ",135.21553959,34.69991223
"兵庫県神戸市中央区生田町１－４－１ショダリ２１－６Ｆ",135.19617721,34.70454204
"兵庫県西宮市山口町下山口４－１４－２５",135.24076801,34.83160034
"兵庫県神戸市西区伊川谷町有瀬１０５２－１",135.01522954,34.66138304
"兵庫県神戸市西区小山１－３－２７",134.98904238,34.68434968
"兵庫県神戸市西区狩場台３－９－８",135.03292972,34.72074344
"兵庫県神戸市西区糀台５－１０－２西神センタービル２Ｆ",135.01679504,34.71996828
"兵庫県神戸市兵庫区上沢通３－１－４",135.16387484,34.67741968
"兵庫県神戸市兵庫区切戸町６－２６",135.17359109,34.66675703
"兵庫県神戸市須磨区横尾１－８",135.10891291,34.67440265
"兵庫県神戸市垂水区本多聞６－２８－２３",135.04929359,34.65255963
"兵庫県神戸市垂水区舞子坂３－５－８",135.03254515,34.64607400
"兵庫県神戸市垂水区塩屋町４－２５－１９",135.08165225,34.63666473
"兵庫県洲本市宇原２２４３",134.87216014,34.33351235
"兵庫県淡路市大町下６６－１",134.85711184,34.43698942
"兵庫県淡路市岩屋１４１４－３５",135.01446728,34.59296050
"兵庫県神戸市東灘区本山北町３－４－１１",135.27744197,34.72703247
"兵庫県神戸市東灘区本山中町３－１－１",135.28408582,34.72581601
"兵庫県神戸市東灘区本山中町４－１－３",135.28178050,34.72511050
"兵庫県神戸市東灘区御影本町２－１５－１９　御影本町ビル４階",135.25638310,34.71429467
"兵庫県神戸市東灘区岡本１－６－１２",135.27638927,34.72777959
"兵庫県芦屋市南宮町１０－２４",135.31816328,34.72888289
"兵庫県芦屋市精道町７－１ハックス芦屋ビル２階西室",135.30403676,34.72781885
"兵庫県芦屋市業平町６－３１",135.30446436,34.73323493
"兵庫県芦屋市三条南町１３－１６－３Ｆ",135.29496522,34.73240709
"兵庫県芦屋市松ノ内町１０－１８",135.30181174,34.73654840
"兵庫県尼崎市長洲東通１－９－３２",135.43555096,34.72682098
"兵庫県尼崎市杭瀬南新町１－１－２３エクセレントシティビル２階",135.43836203,34.71811646
"兵庫県尼崎市御園町２１ＭＧ尼崎駅前ビル１階１０２号",135.41598096,34.71796055
"兵庫県尼崎市御園町５４カーム尼崎３階",135.41669757,34.71778003
"兵庫県尼崎市塚口本町２－２０－１",135.41863994,34.75503125
"兵庫県尼崎市塚口町３－３７－１",135.41038808,34.75516728
"兵庫県尼崎市南塚口町１－３０－１０",135.41475188,34.74829038
"兵庫県尼崎市南塚口町２丁目１塚口さんさんタウン２番館３階３１０号",135.41575988,34.75200938
"兵庫県尼崎市武庫之荘東１－２３－８",135.39594519,34.75659195
"兵庫県尼崎市南武庫之荘１－３－１",135.39540379,34.75110925
"兵庫県尼崎市東園田町４－１０８－２",135.44433546,34.75458463
"兵庫県尼崎市東園田町９－１８－１９",135.44684925,34.75223215
"兵庫県尼崎市若王寺１－２－２３",135.43370847,34.75071817
"兵庫県尼崎市猪名寺２－１５－３０",135.42594452,34.76553848
"兵庫県西宮市甲陽園西山町１－６２",135.32973404,34.76146823
"兵庫県西宮市南郷町４－７",135.33149253,34.74393139
"兵庫県西宮市門戸荘９－１６",135.35773755,34.75617202
"兵庫県西宮市松原町７－２０",135.34734431,34.73611570
"兵庫県西宮市和上町１－１５",135.33881152,34.73818212
"兵庫県西宮市神楽町１１－３さくら夙川クリニックビル３階",135.33118430,34.73860421
"兵庫県西宮市甲子園口３－９－２３",135.37396175,34.73772135
"兵庫県西宮市上田中町７－３",135.37408223,34.70921790
"兵庫県西宮市甲子園町２５－１８",135.36108280,34.71791725
"兵庫県西宮市高松町１１－１０",135.35796554,34.74536492
"兵庫県西宮市高松町５－３９なでしこビル４階",135.35704896,34.74463998
"兵庫県西宮市今津水波町６－３０",135.35214968,34.72911362
"兵庫県西宮市津門呉羽町１－２８今津医療センター４階",135.35219408,34.73126896
"兵庫県伊丹市北野２－９８ＯＭＴビル２階",135.38494816,34.80394479
"兵庫県伊丹市中野北３－６－６シュモアⅡ",135.38040435,34.79114894
"兵庫県伊丹市森本２－１９０",135.43265795,34.78065924
"兵庫県宝塚市逆瀬台４－７－７",135.33543301,34.79072329
"兵庫県宝塚市逆瀬川１－１－１９",135.35121486,34.79895862
"兵庫県宝塚市高松町５－１０",135.36769706,34.79074322
"兵庫県宝塚市光明町１－９",135.36070316,34.79147634
"兵庫県宝塚市旭町２－１５－１１",135.35791967,34.80848817
"兵庫県宝塚市寿町８－２４",135.36607451,34.81186573
"兵庫県川西市小戸１－２－６ジオ阪急川西レジデンスマーク１階",135.41578923,34.82783974
"兵庫県川西市中央町５－５ＯＨＭＩビル５階",135.41509762,34.82807025
"兵庫県川西市平野３－１８－２７",135.41591066,34.87161541
"兵庫県川西市清和台東３－１－８ガーデンモール清和台２階",135.38736657,34.87379883
"兵庫県養父市堀畑８２－２８",134.81152575,35.37168013
"兵庫県三田市武庫が丘７－７－４エムズⅡビル２階",135.20466412,34.88697989
"兵庫県姫路市本町２３１",134.69113164,34.83308860
"兵庫県姫路市市川台３－１２",134.71597906,34.83457479
"兵庫県姫路市東駅前町７５－１",134.69395925,34.82877800
"兵庫県姫路市古二階町１３５",134.69601459,34.83106943
"兵庫県姫路市南畝町２－３１浜屋ハートビル８階",134.68827373,34.82468119
"兵庫県姫路市東山２５１",134.71891314,34.79104895
"兵庫県姫路市木場前七反町６１",134.71891349,34.78096393
"兵庫県明石市西明石南町２－１０－５",134.95794522,34.66550415
"兵庫県明石市西明石南町２－２１－１",134.95885625,34.66471254
"兵庫県三木市大村１４２－７",134.97273688,34.80429527
"兵庫県明石市朝霧南町２－９－５ビラ朝霧２Ｆ",135.01790746,34.64577097
"兵庫県明石市朝霧南町１－１６５－５朝霧ＫＭビル４階",135.01789081,34.64474332
"兵庫県明石市桜町１１－１２",134.99423980,34.64722304
"兵庫県加東市社５１２－１",134.97034789,34.91483148
