address,longitude,latitude
"千葉県千葉市若葉区高根町９６４－４２",140.21966486,35.59440004
"千葉県千葉市緑区鎌取町１３１－３４",140.17328257,35.56683322
"千葉県千葉市緑区おゆみ野３－２－５Ｋ’ｓステーション２Ｆ",140.17750014,35.56329188
"千葉県千葉市緑区おゆみ野３－８－２",140.17794207,35.56059772
"千葉県千葉市緑区おゆみ野南２－１１－１",140.16732472,35.55225118
"千葉県千葉市緑区土気町１６３２－６",140.27264636,35.53110768
"千葉県千葉市緑区土気町３１１",140.28024887,35.52943884
"千葉県千葉市緑区あすみが丘５－５２－４",140.25667270,35.52206612
"千葉県松戸市小金原４－３－２",139.93901583,35.82322341
"千葉県流山市松ケ丘１－４７５",139.95213307,35.84734823
"千葉県流山市中１０２－１",139.91584201,35.85293221
"千葉県流山市南流山２－１８－４プロモシオン南流山１Ｆ",139.90279380,35.83685071
"千葉県流山市南流山２－２４－４",139.90024127,35.83652014
"千葉県野田市木間ケ瀬２４２３－１",139.83182322,36.01925888
"千葉県野田市尾崎台１４",139.83545991,35.98426259
"千葉県我孫子市つくし野１３１－１",140.00529686,35.88442599
"千葉県我孫子市我孫子１８５５－１",140.02735598,35.86524123
"千葉県我孫子市根戸１７４７－６",139.99437572,35.87927135
"千葉県我孫子市柴崎台１－１８－３８",140.04340675,35.87289365
"千葉県我孫子市柴崎台３－１９－２２",140.04428429,35.87664321
"千葉県印西市小倉台４－１２",140.11208222,35.80642279
"千葉県白井市復１４５０－２３",140.06061216,35.79612733
"千葉県白井市笹塚２－２－２コスモビル１０２",140.05353824,35.78568419
"千葉県白井市根１７２０－７",140.03058850,35.78841353
"千葉県白井市根３２５－２－１",140.03242528,35.77041539
"千葉県白井市冨士１２９－２９",140.01765547,35.76817267
"千葉県白井市冨士１２９－３１",140.01782765,35.76844489
"千葉県松戸市高塚新田２４７－１５",139.93975243,35.75574741
"千葉県松戸市稔台１－１２－１１林ビル１０５",139.93070742,35.78836005
"千葉県松戸市金ヶ作１０７－１",139.94493899,35.80381514
"千葉県松戸市常盤平５－１４－２５中山ビル１階",139.96428442,35.79731125
"千葉県松戸市栄町５－３１３",139.90577519,35.80765416
"千葉県松戸市古ケ崎８０３",139.89792662,35.79238651
"千葉県松戸市二十世紀が丘戸山町１１３",139.91466527,35.77291955
"千葉県松戸市松戸２０４４",139.89569377,35.78651784
"千葉県市川市八幡２－１５－１０ＰＡＴＩＯ５階",139.92755137,35.72144738
"千葉県市川市八幡２－５－８ガレリア・サーラ１Ｆ１０６",139.92681251,35.72249167
"千葉県市川市鬼越２－１－７",139.93592028,35.71921700
"千葉県市川市南八幡５－１１－１４",139.92432663,35.72001158
"千葉県市川市市川南１－８－６ＹＳＤビル３１０",139.90646655,35.72771587
"千葉県市川市市川南３－３－２３",139.90401946,35.72924612
"千葉県市川市市川１－４－１０市川ダイエービル９Ｆ",139.90839694,35.72932949
"千葉県市川市新田５－１０－２０",139.91275221,35.72868794
"千葉県市川市本行徳５５２５－２",139.93121927,35.67951698
"千葉県市川市押切２０－３Ｓビル１０１",139.91463692,35.68542246
"千葉県市川市行徳駅前３－１６－２６",139.92006176,35.67975339
"千葉県市川市日之出４－１８",139.92468095,35.67740904
"千葉県市川市相之川１－８－１",139.89748290,35.68135617
"千葉県市川市相之川４－１４－５－３Ｆ",139.90072741,35.67255390
"千葉県市川市相之川４－１５－３友泉南行徳ビル２階",139.90116073,35.67206226
"千葉県市川市北方２－５－１２",139.93855326,35.72522157
"千葉県市川市宮久保２－１－２７",139.93351724,35.73715304
"千葉県市川市東菅野１－５－２",139.92905388,35.72797682
"千葉県市川市東菅野２－５－２２",139.92861217,35.73089578
"千葉県市川市堀之内３－２８－２５",139.91158236,35.76359598
"千葉県船橋市東船橋２－１７－１６",140.00377097,35.70230441
"千葉県船橋市本町７－５－１９－４Ｆ",139.98388929,35.70298211
"千葉県船橋市湊町２－８－９",139.98137871,35.69427766
"千葉県船橋市葛飾町２－３４０フロントンビル４Ｆ",139.95751905,35.70677380
"千葉県鎌ケ谷市富岡１－６－５",140.00027706,35.76820254
"千葉県鎌ケ谷市新鎌ケ谷１－１４－３６",139.99820152,35.78038229
"千葉県船橋市北本町１－１３－１",139.98329732,35.71291428
"千葉県船橋市夏見１－２－１７エスポアール小泉第２－１Ｆ",139.98578062,35.70782042
"千葉県船橋市夏見４－１－３４",139.98765804,35.71365307
"千葉県船橋市習志野台２－１－３アゼリアビル１Ｆ",140.04207795,35.72208904
"千葉県船橋市習志野台４－１３－１６",140.04522780,35.71847284
"千葉県船橋市三山２－１－１１",140.04961447,35.69148420
"千葉県船橋市薬円台５－２０－３",140.03965637,35.70926820
"千葉県船橋市二和東６－１７－３５",140.02333082,35.75540736
"千葉県船橋市芝山４－１７－９",140.02104926,35.72124425
"千葉県船橋市二宮１－５－４",140.02570214,35.70685709
"千葉県船橋市前原西２－７－４",140.01938951,35.69289737
"千葉県船橋市前原西４－１７－１６",140.01543968,35.69623304
"千葉県習志野市香澄２－９－９",140.02689820,35.66631451
"千葉県習志野市谷津５－６－１４",140.00789913,35.68640352
"千葉県習志野市奏の杜２－１－１奏の杜フォルテ２階",140.01567334,35.68951437
"千葉県八千代市勝田台５－５－１０",140.13132323,35.70465666
"千葉県八千代市勝田台７－２６－１７",140.12948349,35.71352805
"千葉県八千代市村上南１－５－２５カセイビル２Ｆ",140.11832539,35.72349066
"千葉県八千代市村上南１－５－２８－２Ｆ",140.11854759,35.72341012
"千葉県八千代市八千代台北１－７－１０",140.09189080,35.70267817
"千葉県八千代市緑が丘２－１－３イオンモール八千代緑が丘３階",140.07316665,35.72802795
"千葉県八千代市緑が丘２－２－１０秋葉緑ヶ丘ビル３Ｆ",140.07097250,35.72677524
"千葉県柏市柏３－１１－８",139.97705534,35.86097443
"千葉県柏市亀甲台町２－３－１",139.98219113,35.84769595
"千葉県柏市光ヶ丘団地２－３",139.95829129,35.82988169
"千葉県柏市つくしが丘１－６－１",139.96298500,35.83595034
"千葉県柏市松葉町４－１２－２",139.97008308,35.88956686
"千葉県柏市あけぼの４－４－２５－１Ｆ",139.96903662,35.86612063
"千葉県柏市明原３－３－１２折戸ビル１階３号室",139.96250397,35.86633151
"千葉県柏市篠籠田６１７",139.96120395,35.87301647
"千葉県柏市豊四季３０１－７",139.94869171,35.86043477
"千葉県柏市若柴１７８－４柏の葉キャンパス１４８街区１",139.95256773,35.89472089
"千葉県野田市山崎１６４９－３",139.88854675,35.93273300
"千葉県野田市山崎１８５０－１梅郷メディカルプラザ１階",139.89054412,35.92914450
"千葉県野田市山崎２７０２",139.90085233,35.92087049
"千葉県野田市桜台２４－２",139.87389490,35.93384390
"千葉県浦安市当代島１－１－１１フォーレストビル５階",139.89192281,35.66584015
"千葉県浦安市当代島３－５－１",139.89326136,35.67207310
"千葉県浦安市北栄１－１６－１７原勝ビル４階",139.89330605,35.66538471
"千葉県浦安市猫実２－３１－１０アドラブール１０３",139.89865305,35.66091859
"千葉県浦安市猫実３－１８－１２",139.89753639,35.66280174
"千葉県浦安市猫実３－１８－１７",139.89775026,35.66282398
"千葉県浦安市猫実５－１８－２０－ＫＯビル１階",139.89190342,35.66443472
"千葉県浦安市美浜３－１－５",139.90528905,35.65010021
"千葉県浦安市入船１－４－１イオン新浦安店６階",139.91485223,35.64903652
"千葉県浦安市入船４－１－１新浦安中央ビル２階",139.91670764,35.64936427
"千葉県浦安市入船４－１８－１２",139.91937956,35.65168353
"千葉県浦安市日の出１－１－２５",139.92129620,35.64872825
"千葉県浦安市日の出２－１－５",139.92186835,35.64934764
"千葉県浦安市明海４－１－１ニューコースト新浦安３階",139.92281574,35.64291218
"千葉県浦安市富岡３－２－６",139.90093692,35.64275639
"千葉県浦安市堀江２－３０－８",139.89387586,35.65587166
"千葉県浦安市富士見２－１８－９",139.89026527,35.65072479
"千葉県成田市三里塚御料牧場１",140.38692134,35.76350209
"千葉県東金市台方２０５８－１",140.34502191,35.55586279
"千葉県四街道市四街道２－１７－１６",140.16012610,35.65977210
"千葉県佐倉市大崎台４－３－５",140.21908676,35.70477976
"千葉県佐倉市下志津２１８番地",140.17084160,35.71944294
"千葉県佐倉市上志津原３６－５",140.14364411,35.70247399
"千葉県印旛郡酒々井町飯積２－８－９",140.29293890,35.70902612
"千葉県成田市中台６－２－１",140.29993234,35.78409228
"千葉県成田市幸町４８３",140.31555035,35.78308417
"千葉県成田市花崎町８４２－３",140.31532550,35.77894024
"千葉県富里市日吉倉５７２－２",140.32333890,35.76835556
"千葉県香取市佐原ロ２０２８－４３",140.49460989,35.90155395
"千葉県香取市北３－１３－１０",140.49719026,35.89557428
"千葉県香取市佐原イ２４０３－１",140.50775859,35.88536232
"千葉県香取市津宮１２９５－１",140.53075570,35.89807771
"千葉県銚子市松岸町４－７７８－５１",140.79199832,35.74030494
"千葉県香取市三ノ分目２５５－７",140.58391582,35.87665607
"千葉県香取市小見川５４８",140.60910578,35.85409826
"千葉県香取市府馬２８０５",140.60639357,35.80112524
"千葉県八街市八街に８５",140.32522359,35.66235611
"千葉県八街市東吉田５１７－５７",140.31040911,35.64814744
"千葉県匝瑳市椿１２６８",140.59620965,35.71763309
"千葉県匝瑳市八日市場イ２７３５－４",140.54340532,35.69818110
"千葉県香取郡多古町多古２５３１",140.46652458,35.73445275
"千葉県市原市辰巳台東３－１５－２",140.15278363,35.51688539
"千葉県市原市玉前７６",140.07688637,35.51636146
"千葉県市原市ちはら台東１－２－１３",140.19132993,35.52968700
"千葉県木更津市万石３４１－１",139.93352090,35.41718147
"千葉県木更津市ほたる野１－２８－３",139.96418170,35.37288545
"千葉県木更津市清見台南１－９－６",139.94862880,35.38284814
"千葉県木更津市清見台３－６－５",139.94596530,35.37961521
"千葉県木更津市請西南４－２－９",139.94126136,35.35730986
"千葉県木更津市かずさ鎌足２－３－９",139.98929188,35.33475493
"千葉県富津市大堀２－１４－１５",139.85480043,35.33269299
"千葉県富津市大堀４－１－２４",139.84965369,35.33278460
"千葉県富津市青木１６４１",139.84957064,35.32583288
"千葉県館山市館山８０９－２",139.85749154,34.98316527
"千葉県南房総市千倉町大川６３８",139.94530141,34.93194472
"千葉県茂原市東部台２－２０－１",140.32227719,35.42144524
"千葉県茂原市東部台３－２１－６",140.32381314,35.42088700
"千葉県茂原市東郷２０００",140.31018668,35.43402654
"千葉県茂原市緑ケ丘４－３－３",140.26057300,35.43926871
"千葉県茂原市長尾２５９２",140.29864072,35.44944861
"千葉県袖ケ浦市蔵波台４－１３－８",139.99596136,35.44189490
"千葉県袖ケ浦市長浦駅前５－２１",140.00625515,35.44567561
"千葉県袖ケ浦市福王台１－１０－９",139.95865694,35.42842183
"千葉県袖ケ浦市奈良輪１－８－８",139.95718487,35.43051598
"千葉県袖ケ浦市袖ケ浦駅前１－３９－２",139.95642383,35.43347669
"千葉県君津市上２３８",139.95495389,35.30686733
"千葉県君津市久保１－２－２",139.89800764,35.33171894
"千葉県君津市杢師１－１－１",139.90829297,35.32776970
"千葉県富津市湊４９７－５",139.87468743,35.21887997
"千葉県南房総市富浦町原岡１３７－１",139.83804424,35.03982938
"千葉県南房総市和田町仁我浦１９－１",140.01780783,35.03957683
"千葉県大網白里市四天木乙２８２７－２１",140.41569037,35.48241188
"千葉県大網白里市北飯塚３４５－１",140.35031581,35.50740489
"千葉県大網白里市みどりが丘３－１０－６",140.31551109,35.54170004
"千葉県長生郡白子町南日当８５１",140.36117176,35.45816404
"千葉県いすみ市岬町桑田２５３１",140.34873410,35.30862384
"茨城県土浦市大和町９－２ウララ２－３０３",140.20341963,36.07811599
"茨城県土浦市生田町３－２７",140.18896793,36.08237334
"茨城県稲敷郡阿見町中郷２－１－３",140.21701033,36.04124914
"茨城県土浦市荒川沖西１－１７－４",140.16234809,36.03411775
"茨城県土浦市荒川沖西２－１２－２",140.16189264,36.02941827
"茨城県土浦市中荒川沖町２５－６",140.16758652,36.03329853
"茨城県牛久市中央１－２１－３",140.14335160,35.98145202
"茨城県牛久市中央５－１２－１７",140.14242683,35.97756369
"茨城県稲敷市中山４３７７",140.28510524,35.90497263
"茨城県取手市桜が丘１－１７－１",140.12393633,35.90927104
"茨城県つくば市吉沼１１５１",140.01200455,36.14467109
"茨城県つくば市篠崎２２７２－１",140.05737010,36.13800918
"茨城県桜川市真壁町真壁４２５",140.10187748,36.27959738
"茨城県筑西市海老ケ島９２６",140.04034562,36.24819384
"茨城県龍ケ崎市大徳町１２９８－３大徳ヘルシービル１Ｆ",140.20068152,35.90615274
"茨城県取手市東１－２－１２",140.06654539,35.89004178
"茨城県守谷市立沢１４２－１６",139.97016332,35.95163105
"茨城県守谷市けやき台６－１６－１４",139.99040676,35.93764448
"茨城県常総市水海道山田町１５４２－８",139.99131758,36.01593841
"茨城県下妻市長塚２８－１",139.95315344,36.18179952
"茨城県下妻市下妻丁８１－７",139.95913055,36.17769711
"茨城県つくば市栗原３４４３",140.10686653,36.12209821
"茨城県つくば市二の宮２－２－２６",140.11931169,36.06548516
"茨城県つくば市松野木１６２－７",140.11468975,36.05942207
"茨城県つくば市高野台２－１６－８",140.12100456,36.02553237
"茨城県古河市本町１－９－１５",139.70654302,36.19788751
"茨城県古河市下大野２８５４",139.74987646,36.18214599
"茨城県坂東市岩井３２９３",139.88458716,36.04919081
"茨城県坂東市辺田３１０－５２",139.90343875,36.03194307
"茨城県結城市大字結城３５４－３",139.87667735,36.30016695
"茨城県結城市上山川５０４９－１４",139.85813226,36.27360549
"茨城県筑西市野殿１５９５－２",139.97109429,36.27541963
"茨城県笠間市笠間９８１－８",140.25679640,36.38368231
"茨城県笠間市鯉淵６２６６－１４０",140.32544482,36.34807161
"茨城県笠間市東平４－５－３４",140.31674040,36.34495796
"茨城県水戸市三の丸１－４－７３水戸京成ビル１階",140.47560940,36.37355181
"茨城県水戸市泉町３－１－３０",140.46181010,36.37912044
"茨城県水戸市西原２－１７－３２",140.43349274,36.38936036
"茨城県水戸市見川２－１９２－３",140.43542894,36.37306184
"茨城県常陸太田市徳田町４７４",140.47928069,36.78569463
"茨城県潮来市日の出８－１３－２",140.56322969,35.93455986
"茨城県潮来市あやめ２－２７－１１",140.55140563,35.93791740
"茨城県東茨城郡茨城町奥谷１０７６",140.41624829,36.28561998
"茨城県行方市手賀３１２５",140.42537576,36.08936215
"茨城県行方市島並１５１１",140.49120149,36.02453612
"茨城県ひたちなか市中根５１２５－２",140.54489476,36.38484093
"茨城県神栖市土合本町２－９８０９－２０",140.77834744,35.79223313
"茨城県石岡市茨城３－５－３１",140.28494232,36.17785462
"茨城県かすみがうら市稲吉東１－１５－１",140.25293002,36.12600088
"茨城県日立市鮎川町３－１－２１",140.63944108,36.56418211
"茨城県日立市助川町１－７－９",140.65154147,36.59861454
"茨城県日立市留町１１６６",140.59963691,36.49439150
"茨城県常陸大宮市中富町１００３－６",140.40877880,36.54624222
"茨城県常陸大宮市上小瀬１４２６－１",140.32637594,36.60278057
"茨城県久慈郡大子町大子８５６－１",140.35400421,36.76957624
"栃木県宇都宮市松原２－３－１４",139.87193164,36.57172125
"栃木県宇都宮市大通り１－３－１６",139.89133344,36.56057314
"栃木県宇都宮市兵庫塚３－２９－２８",139.85548359,36.49538725
"栃木県下都賀郡壬生町おもちゃのまち２－４－８",139.83719175,36.46637919
"栃木県那須烏山市田野倉１８３",140.09348294,36.66052175
"栃木県宇都宮市平出町３６８－８",139.94694997,36.57098507
"栃木県宇都宮市石井町３２３６－１",139.92740079,36.53754865
"栃木県宇都宮市下栗町１５０５",139.89774256,36.53530339
"栃木県宇都宮市元今泉１－３－１１",139.90227965,36.56232058
"栃木県日光市安川町８－２５",139.59620480,36.75349588
"栃木県宇都宮市徳次郎町５－５",139.84781735,36.63046890
"栃木県宇都宮市徳次郎町８８８",139.84064809,36.63932878
"栃木県宇都宮市清原台５－１４－１９",139.99599354,36.55183020
"栃木県宇都宮市ゆいの杜３－２－２３",139.98729912,36.57107492
"栃木県宇都宮市清原工業団地１５－１",139.98396200,36.54700244
"栃木県真岡市大谷本町３－２０",139.99702094,36.43214360
"栃木県真岡市大谷本町７－１７",139.99663747,36.43684308
"栃木県真岡市上大沼１２７－１",139.95389995,36.43565561
"栃木県鹿沼市千渡２３４８－８",139.77882582,36.56368366
"栃木県小山市喜沢１４７５",139.80651047,36.33383582
"栃木県小山市犬塚１－２１－８",139.83161712,36.30757606
"栃木県足利市寿町９－２８",139.46668888,36.32496964
"栃木県足利市葉鹿南町１３－９",139.38691568,36.35975352
"栃木県足利市福居町５８９",139.45511199,36.30564607
"栃木県佐野市浅沼町８０４－３",139.59249840,36.31044974
"栃木県佐野市植上町１７５２－２",139.57956360,36.30391670
"栃木県栃木市入舟町１４－３",139.73101118,36.38188018
"栃木県栃木市今泉町２－１０－１８",139.74595648,36.38531914
"栃木県下野市薬師寺２４７２－１５",139.86541775,36.39153898
"栃木県下野市石橋２３８－１",139.86741005,36.43637223
"栃木県河内郡上三川町しらさぎ１－１９－８",139.90840069,36.44132566
"栃木県宇都宮市下岡本町４５５６－５",139.93328020,36.59874224
"栃木県塩谷郡高根沢町大字花岡２３５１",140.00436390,36.65559747
"栃木県さくら市氏家３２４５－１７",139.96790417,36.70108519
"埼玉県さいたま市浦和区東高砂町２９－１８",139.66193858,35.85971250
"埼玉県さいたま市浦和区東高砂町３－２ハイフィールドビル４階",139.65856396,35.85742662
"埼玉県さいたま市浦和区東仲町４－１７",139.65637511,35.86223985
"埼玉県さいたま市浦和区常盤１０－１０－１８　マスナガエンビル２Ｆ",139.64184000,35.87186882
"埼玉県さいたま市浦和区高砂２－５－１　ＫＯＭＯＮ　３階",139.65378386,35.85756257
"埼玉県さいたま市浦和区岸町４－２３－８",139.65569766,35.85509905
"埼玉県さいたま市浦和区岸町４－２４－１２",139.65543100,35.85556565
"埼玉県さいたま市浦和区元町２－８－１２",139.64932266,35.87195513
"埼玉県さいたま市大宮区宮町２－９０",139.62872905,35.90993326
"埼玉県さいたま市大宮区堀の内町２－１６０",139.63600904,35.91169430
"埼玉県さいたま市大宮区堀の内町２－１７３",139.63567296,35.91151099
"埼玉県さいたま市大宮区下町２－１６－１　アクロスビル３階",139.62784587,35.90395636
"埼玉県さいたま市大宮区大門町３－１０８－８",139.63072893,35.90787527
"埼玉県さいたま市大宮区大成町３－３３９－２　光ビル",139.61578266,35.91873145
"埼玉県さいたま市大宮区桜木町１－１８５－１",139.62213797,35.90317305
"埼玉県さいたま市西区宮前町４０８－１",139.59470368,35.92501309
"埼玉県さいたま市西区中野林６４３",139.58579395,35.89177392
"埼玉県さいたま市北区本郷町５０",139.62488149,35.93828954
"埼玉県さいたま市北区吉野町１－３７７－４",139.61083507,35.95130846
"埼玉県さいたま市北区宮原町４－３９－５",139.61539316,35.94572649
"埼玉県さいたま市北区大成町４－３１８－３",139.61338000,35.92221965
"埼玉県さいたま市北区奈良町３２－６",139.60283593,35.94651735
"埼玉県さいたま市北区東大成町１－２２７",139.62109610,35.92078406
"埼玉県川口市末広３－４－２８",139.74096133,35.80644606
"埼玉県川口市元郷４－１－３",139.73250118,35.79555306
"埼玉県川口市幸町１－７－１川口パークタワー２Ｆ",139.72279638,35.80492326
"埼玉県川口市栄町１－１２－２１シティデュオタワー２０６",139.72761267,35.80222943
"埼玉県川口市西川口２－２－９",139.70190065,35.81303557
"埼玉県川口市戸塚境町３５－１０フォルテシモ１階",139.75685261,35.86154169
"埼玉県川口市大字新井宿８０２－５",139.72886958,35.84238199
"埼玉県川口市安行領根岸３１８０イオンモール川口３Ｆ",139.72358966,35.83781857
"埼玉県川口市安行領根岸９０４－１",139.71091808,35.85065844
"埼玉県川口市芝中田１－３０－８",139.69905598,35.83081628
"埼玉県川口市桜町２－５－１９",139.73897445,35.83881592
"埼玉県川口市坂下町４－１６－２６",139.73828056,35.82561776
"埼玉県川口市南鳩ヶ谷１－９－６",139.73933340,35.82038251
"埼玉県川口市南鳩ヶ谷７－２７－１５",139.73066469,35.82322057
"埼玉県川口市榛松２－６－８",139.77469910,35.82307326
"埼玉県川口市東本郷１４３２",139.76030610,35.82658826
"埼玉県蕨市中央３－１９－１４",139.68606005,35.82598619
"埼玉県蕨市中央３－３－１５－２Ｆ",139.68790986,35.82714439
"埼玉県蕨市錦町２－２０－１２",139.66906994,35.82420834
"埼玉県戸田市下戸田１－１８－２－２Ｆ",139.68424662,35.81277980
"埼玉県戸田市喜沢１－１８－８まるたけビル１Ｆ",139.69688162,35.81355209
"埼玉県戸田市喜沢南２－７－１４",139.69045722,35.80651991
"埼玉県戸田市川岸２－７－３０",139.68403276,35.80522563
"埼玉県戸田市上戸田２－１－１５",139.68093854,35.81628469
"埼玉県戸田市上戸田８４－２アンレーヴ戸田１０１",139.67345583,35.81960343
"埼玉県戸田市本町５－１２－３６エトワール戸田公園１階",139.67728067,35.80690002
"埼玉県戸田市本町５－１３－１９",139.67772784,35.80680561
"埼玉県戸田市笹目５－２０－１０",139.64266961,35.81696976
"埼玉県さいたま市南区太田窪２－１０－２６",139.66863517,35.86077357
"埼玉県さいたま市南区太田窪２－１１－２２",139.66749082,35.86078744
"埼玉県さいたま市南区南浦和３－２８－７",139.67419357,35.84743353
"埼玉県さいたま市南区南本町１－７－４－５Ｆ",139.66743587,35.84638080
"埼玉県さいたま市南区別所５－６－１２",139.64088520,35.85380153
"埼玉県さいたま市南区別所７－２－１－１０１Ａ",139.64937635,35.84714976
"埼玉県さいたま市南区別所７－２－１－１０１Ｃ",139.64937635,35.84714976
"埼玉県さいたま市南区白幡４－２１－７武蔵浦和医療ビル２Ｆ",139.65170131,35.84282531
"埼玉県さいたま市南区文蔵３－１１－３ユニット・ワンビル２Ｆ",139.67552716,35.83852899
"埼玉県さいたま市南区鹿手袋２－２２－１０",139.63833831,35.85163505
"埼玉県さいたま市南区四谷２－１－３",139.63535834,35.84370814
"埼玉県さいたま市南区曲本３－６－２",139.63812224,35.83682567
"埼玉県さいたま市南区大谷口５６１０",139.69474983,35.85612150
"埼玉県さいたま市緑区三室９５０－１",139.67598938,35.88851461
"埼玉県さいたま市緑区東浦和５－１３－２",139.70408197,35.86714249
"埼玉県さいたま市緑区美園５－４６－７",139.73217608,35.89268985
"埼玉県さいたま市見沼区大字東門前４３－１",139.66521707,35.93202013
"埼玉県さいたま市見沼区南中丸１０３２－１２",139.65431302,35.91964644
"埼玉県さいたま市見沼区東大宮３－２－２２",139.63240804,35.95370414
"埼玉県さいたま市見沼区東大宮５－５３－３",139.64289614,35.95063601
"埼玉県さいたま市見沼区大和田町１－１２７５",139.65091873,35.92553728
