address,longitude,latitude
"東京都新宿区神楽坂６－４２神楽坂喜多川ビル１階",139.73507363,35.70357300
"東京都新宿区横寺町５５旺文社アネックスビル１Ｆ",139.73355720,35.70062606
"東京都新宿区市谷砂土原町１－２",139.73546559,35.69467953
"東京都新宿区西新宿１－２６－２新宿野村ビル５Ｆ",139.69533867,35.69300371
"東京都新宿区西新宿１－２５－１新宿センタービル４Ｆ",139.69529705,35.69183996
"東京都新宿区西新宿２－４－１新宿ＮＳビル４Ｆ",139.69374455,35.68818756
"東京都新宿区西新宿２－４－１新宿ＮＳビル６Ｆ",139.69374455,35.68818756
"東京都新宿区西新宿６－８－１新宿オークタワーＬＢ階",139.69054182,35.69393126
"東京都新宿区西新宿２－３－２ＫＤＤＩビル１階",139.69479169,35.68798483
"東京都中野区中野２－１３－２３岡デンタルビル２Ｆ",139.66871828,35.70505990
"東京都中野区中野４－１０－１中野セントラルパークイースト１階",139.66300478,35.70778997
"東京都中野区中野５－４５－４",139.66735161,35.70813729
"東京都中野区東中野４－７－８ロアール東中野１Ｆ",139.68381686,35.70762950
"東京都中野区中央２－１４－９",139.68180902,35.69992755
"東京都中野区本町２－４６－１中野坂上サンブライトツイン３階",139.68205635,35.69663628
"東京都中野区本町３－７－５",139.67745688,35.69354484
"東京都中野区本町６－１２－１３",139.66777435,35.69487497
"東京都中野区南台２－４５－１０",139.67130775,35.68540952
"東京都中野区南台３－３７－２７シルクれじでんす１階",139.66514726,35.68350127
"東京都中野区丸山２－１７－１３",139.65186612,35.72456835
"東京都中野区野方６－８－７",139.65255788,35.72097432
"東京都中野区鷺宮２－５－７宮ビル２Ｆ",139.64520278,35.72485426
"東京都中野区鷺宮３－３２－５",139.63832838,35.72423748
"東京都中野区若宮２－２３－６",139.64451158,35.71567470
"東京都中野区大和町１－３０－６",139.65160568,35.70983388
"東京都杉並区阿佐谷北１－４１－５",139.63650143,35.70937797
"東京都杉並区高円寺北３－２５－２０ＳＫビル１Ｆ",139.64897267,35.70776459
"東京都杉並区高円寺北３－３５－２６Ｔ’Ｓ　ｇａｒｄｅｎ高円寺１階",139.64949202,35.70881449
"東京都杉並区高円寺南１－７－３山手杉並ビル２階",139.65777509,35.69833537
"東京都杉並区高円寺南２－１６－１３エル二ド１Ｆ",139.64918694,35.69860177
"東京都杉並区高円寺南４－２４－１五城ビル３階",139.64947281,35.70363730
"東京都杉並区高円寺南４－６－７アンフィニビル３階",139.64902009,35.70303458
"東京都杉並区梅里１－７－１５３Ｆ",139.64890924,35.69733247
"東京都杉並区阿佐谷南１－９－２",139.63894894,35.69865426
"東京都杉並区阿佐谷南３－３７－１ＰＬＡＮＯ５階",139.63584616,35.70431186
"東京都杉並区和田３－４９－７",139.65819180,35.69646894
"東京都杉並区堀ノ内２－２９－１４ライオンズマンション新高円寺１階",139.65349524,35.69036677
"東京都杉並区成田東５－３６－１１",139.63286330,35.69957066
"東京都杉並区井草１－２－５ワイズスクエア１０１",139.62436562,35.72407604
"東京都杉並区上井草２－１９－４",139.60764216,35.72125087
"東京都杉並区西荻北２－５－５",139.60220163,35.70435540
"東京都杉並区上荻１－１６－６第二丸三ビル３Ｆ",139.61869197,35.70520295
"東京都杉並区上荻２－４２－１１",139.61460051,35.70789421
"東京都杉並区荻窪５－１９－１５",139.61983087,35.70291435
"東京都杉並区松庵１－８－６",139.59299165,35.69414520
"東京都杉並区松庵３－４０－１３－１Ｆ",139.59852418,35.70336097
"東京都杉並区高井戸東２－３－１４",139.61473222,35.67775606
"東京都杉並区上高井戸１－８－８",139.61572403,35.67057083
"東京都新宿区西早稲田２－２１－１６圓生楼高田馬場ビル２Ｆ",139.71057828,35.71120762
"東京都新宿区西早稲田２－４－８",139.71595014,35.70851918
"東京都新宿区大久保１－１１－３大東ビル３階",139.70402101,35.69855887
"東京都新宿区大久保２－３－５藤和大久保コープ１Ｆ",139.70876761,35.70378618
"東京都新宿区百人町３－２２－１",139.69904899,35.70470248
"東京都新宿区北新宿２－２－２８フロントパーク新宿１階",139.69039449,35.69716145
"東京都新宿区高田馬場１－８－８",139.70758690,35.71054095
"東京都新宿区高田馬場２－１８－１１稲門ビル２Ｆ",139.70500922,35.71377107
"東京都新宿区高田馬場２－５－２４",139.71073927,35.71394065
"東京都豊島区西巣鴨１－１９－１７",139.72529822,35.73693009
"東京都豊島区西巣鴨１－９－１",139.72330113,35.73762997
"東京都豊島区巣鴨１－１６－２アーバンハイツ巣鴨Ｂ棟",139.74177196,35.73401974
"東京都豊島区巣鴨２－５－１２真野ビル３Ｆ",139.73972491,35.73379193
"東京都豊島区巣鴨３－３０－３",139.73704457,35.73397239
"東京都豊島区駒込１－３８－２－２階",139.74766029,35.73593358
"東京都豊島区駒込６－３４－７駒込東栄ビル１階・２階",139.74263270,35.74127164
"東京都豊島区北大塚２－１０－５北大塚ＢＭＡビル３階",139.72714820,35.73375550
"東京都豊島区北大塚２－１３－１ｂａ０７－５Ｆ",139.72864257,35.73232514
"東京都豊島区北大塚２－１７－１２",139.72803424,35.73358887
"東京都豊島区北大塚２－２－５晴和ビル３階",139.72763710,35.73217792
"東京都豊島区北大塚２－６－１２",139.72801206,35.73240290
"東京都豊島区南大塚３－２－６Ｋ－ＢＵＩＬＤＩＮＧ　２０３",139.72935938,35.72712300
"東京都豊島区東池袋１－１２－１０ヤンズビル７階",139.71440778,35.72947511
"東京都豊島区東池袋１－２１－１１オーク池袋ビル８階",139.71561875,35.73041949
"東京都豊島区東池袋３－５－４",139.71739635,35.73114445
"東京都豊島区池袋１－５－８",139.71315487,35.73520499
"東京都豊島区東池袋３－１－１サンシャイン６０－７階",139.71816302,35.72934189
"東京都豊島区池袋２－２４－２",139.70356688,35.73325217
"東京都豊島区池袋２－６１－５",139.70976906,35.73484384
"東京都豊島区池袋３－２８－３",139.70571384,35.73514369
"東京都豊島区池袋３－７０－１",139.70609980,35.73812948
"東京都豊島区池袋４－１７－１０",139.70816621,35.73973769
"東京都豊島区西池袋１－１７－１０エキニア池袋７Ｆ",139.70872487,35.73099979
"東京都豊島区南池袋１－２７－１０油木第一ビル２Ｆ",139.71303845,35.72928066
"東京都豊島区高田３－１４－２９ＫＤＸ高田馬場１Ｆ",139.70510083,35.71504314
"東京都豊島区高松２－５６－７",139.69825039,35.73976242
"東京都豊島区長崎４－７－１１マスターズ東長崎",139.68386036,35.73005474
"東京都豊島区南長崎５－１７－９",139.68226055,35.72887705
"東京都板橋区板橋１－２１－５",139.71849003,35.74723432
"東京都板橋区板橋１－２１－７－１Ｆ",139.71865391,35.74715655
"東京都板橋区板橋２－５－１",139.71296829,35.74672036
"東京都板橋区大和町１４－１６",139.70550722,35.76041857
"東京都板橋区大山東町５８－２０北村ビル１０１",139.70298569,35.74947257
"東京都板橋区大山町１０－１０",139.70127202,35.74764496
"東京都板橋区大山町４１－３",139.69903325,35.74928916
"東京都板橋区大山西町７０－１０－１Ｆ",139.69348934,35.74726143
"東京都板橋区幸町２１－１３プラザさいわい１０１",139.70012782,35.74385646
"東京都板橋区小茂根１－２５－１０",139.67686022,35.74658043
"東京都板橋区小茂根４－２８－１４",139.67258288,35.74511659
"東京都板橋区加賀１－３－１",139.72067014,35.75357809
"東京都板橋区東坂下１－９－５リビエールオオノ１階",139.69071319,35.78053233
"東京都板橋区坂下２－２８－７",139.68510795,35.78427900
"東京都板橋区蓮根２－３１－３内田萩原共同ビル２Ｆ",139.67870855,35.78386217
"東京都板橋区小豆沢２－２３－１５",139.69960427,35.77695798
"東京都板橋区清水町４７－７",139.70531538,35.76479024
"東京都板橋区宮本町５１－１５",139.70104629,35.76465958
"東京都板橋区泉町２３－８",139.69832703,35.76535941
"東京都板橋区志村２－１０－９",139.69129940,35.77652729
"東京都板橋区中台１－４－７",139.68222277,35.76533389
"東京都板橋区常盤台１－４４－１ＢＥＬＩＳＴＡ常盤台１階",139.69045851,35.75844610
"東京都板橋区常盤台１－６１－３",139.69483598,35.75789357
"東京都板橋区常盤台１－７－１７",139.69063621,35.75980982
"東京都板橋区常盤台２－２５－２０",139.68999168,35.76268168
"東京都板橋区南常盤台１－２９－１１",139.68886418,35.75849326
"東京都板橋区上板橋１－２６－１３",139.67634840,35.76296735
"東京都板橋区上板橋２－３－１０",139.67408755,35.76169521
"東京都板橋区高島平１－７３－１",139.66775670,35.78686142
"東京都板橋区高島平２－２１－６",139.65853263,35.78366994
"東京都板橋区高島平４－１７－５",139.64899996,35.78809421
"東京都板橋区高島平４－３０－６",139.65118031,35.78985504
"東京都板橋区高島平８－１２－９",139.66226271,35.79000245
"東京都板橋区高島平９－１７－３",139.66589851,35.78862221
"東京都板橋区徳丸２－６－１イオン板橋ショッピングセンター４階",139.66092456,35.77011055
"東京都板橋区三園１－４７－７",139.64304766,35.79177949
"東京都練馬区練馬１－２６－１",139.58973373,35.76142087
"東京都練馬区桜台１－８－８",139.66217017,35.73922809
"東京都練馬区桜台２－１－７",139.66777789,35.74224457
"東京都練馬区小竹町２－８１－８",139.67246349,35.74429168
"東京都練馬区豊玉北４－１１－９",139.65917060,35.73538123
"東京都練馬区豊玉北４－８－１４",139.65900676,35.73439244
"東京都練馬区豊玉北６－１－７メイゾン豊玉２Ｆ",139.65201559,35.73693087
"東京都練馬区貫井３－１４－６",139.62897583,35.73654699
"東京都練馬区中村３－１７－６",139.63925571,35.73271713
"東京都練馬区石神井町２－１５－１ＮＭＳビル１階奥",139.60739953,35.74546761
"東京都練馬区上石神井４－３－２３",139.59125160,35.72798579
"東京都練馬区関町北２－２６－１１",139.57646675,35.72654949
"東京都練馬区立野町２５－５",139.57905862,35.71608406
"東京都練馬区大泉学園町６－１９－３８",139.58622298,35.77183297
"東京都練馬区東大泉４－２６－４塩野第２ビル２Ｆ",139.58504558,35.75147749
"東京都練馬区東大泉７－３６－１０",139.57955736,35.74670565
"東京都練馬区南大泉５－３６－９",139.56832768,35.74921892
"東京都練馬区旭町１－１５－１９ラ・フォンテーヌイン光が丘２階",139.62509447,35.76491593
"東京都練馬区光が丘２－１０－２光が丘ＩＭＡ東館２階",139.62951927,35.76060819
"東京都練馬区春日町５－３３－３０メディカルガーデン春日町１Ｆ",139.63741901,35.75122332
"東京都練馬区土支田４－６－７１Ｆ",139.61559525,35.76690427
"東京都練馬区北町２－４１－２１サンプロシード１Ｆ",139.66423266,35.76799700
"東京都練馬区北町３－７－１９",139.65551120,35.76860784
"東京都練馬区北町７－２０－３３",139.65063125,35.76347503
"東京都練馬区平和台１－３１－３",139.66299431,35.75726214
"東京都練馬区氷川台４－７－１",139.66769406,35.75320995
"東京都練馬区早宮１－２２－１４",139.65912554,35.74988512
"東京都武蔵野市吉祥寺北町２－１９－９",139.57739769,35.71512579
"東京都武蔵野市吉祥寺北町２－５－１７",139.57963095,35.71182622
"東京都武蔵野市吉祥寺東町１－１９－２３",139.58496410,35.70496600
"東京都武蔵野市吉祥寺南町１－１－１０吉祥寺ＭＡビル７Ｆ",139.57758705,35.70291884
"東京都武蔵野市吉祥寺南町１－６－１８ルネ吉祥寺Ｂ－２０１Ａ",139.58023132,35.70134130
"東京都武蔵野市吉祥寺南町１－９－１０",139.57818425,35.70209116
"東京都武蔵野市中町１－１２－１０スカイゲートタワー５ＦＢ号",139.56095514,35.70449332
"東京都武蔵野市関前３－３－９",139.55699953,35.71393384
"東京都武蔵野市関前５－８－１０",139.54380071,35.71372247
"東京都武蔵野市境１－１－７ＱｕＯＬａ１階",139.54504003,35.70229603
"東京都武蔵野市境１－９－９",139.54490660,35.70443467
"東京都武蔵野市境２－１４－１スイング８０３号",139.54310683,35.70280704
"東京都武蔵野市境南町２－１２－１２ヴィラキャスケード１階",139.54412638,35.69829090
"東京都武蔵野市境南町２－９－３大矢ビル２Ｆ",139.54511232,35.70027959
"東京都三鷹市井の頭５－７－３６ＳＡＫＵＲＡ１階",139.57773175,35.69583631
"東京都三鷹市上連雀２－９－５",139.55794165,35.70167970
"東京都三鷹市下連雀３－３６－１トリコナ３Ｆ",139.56020811,35.70160197
"東京都三鷹市下連雀３－３８－４三鷹産業プラザ５Ｆ－Ｂ",139.56022489,35.69878563
"東京都三鷹市野崎１－２２－８レヴァンティア１Ｆ",139.54973750,35.68305379
"東京都調布市仙川町１－１１－８仙川ＦＴビル２Ｆ",139.58458515,35.66162369
"東京都調布市若葉町２－１－６",139.58597124,35.65886849
"東京都調布市菊野台２－５－２１オガワアグリコート１階",139.56556501,35.65260496
"東京都調布市深大寺北町６－３８－６ブルージュ１階",139.54696845,35.67874866
"東京都調布市深大寺元町４－３１－２",139.54412173,35.67139666
"東京都調布市国領町３－３－２０よろずやビル２０１号室",139.55895484,35.64874163
"東京都調布市小島町２－４０－１０",139.54152597,35.64968306
"東京都府中市白糸台３－１６－５",139.51692155,35.66638006
"東京都府中市小柳町２－１２－２",139.50154237,35.66255227
"東京都府中市片町２－２０－３サンノーブル１階１０３号室",139.46907819,35.66998116
"東京都府中市宮西町５－２",139.47641650,35.66949528
"東京都府中市四谷３－３７－１４",139.44368338,35.66371452
"東京都府中市栄町２－１０－３",139.47944616,35.68692668
"東京都府中市府中町１－１－５高木ビル４Ｆ",139.48009941,35.67298942
"東京都府中市府中町２－９－１６ウェルーチアビル２Ｆ",139.48199091,35.67361163
"東京都府中市寿町１－１－３三ッ木寿町ビル７階Ａ１",139.47848011,35.67277274
"東京都府中市晴見町１－２０",139.47868809,35.68164117
"東京都府中市晴見町３－１１－２１",139.47879908,35.68456028
"東京都小金井市本町２－１０－２０",139.51045682,35.70281737
"東京都小金井市本町５－１９－３３",139.50581833,35.70255615
"東京都小金井市本町６－１４－２８アクウェルモール３Ｆ",139.50574618,35.70066747
"東京都小金井市東町３－１２－１１",139.53052473,35.69934326
"東京都小金井市東町４－４３－１５ＭＫジェムズマンション１Ｆ",139.52471409,35.70007638
"東京都小金井市中町３－７－４",139.51092645,35.69728467
"東京都国分寺市戸倉４－４５－５Ｋエリタージュ１０２",139.45682489,35.71340086
"東京都国分寺市本町２－１０－９島田ビル２階",139.48116208,35.70150004
"東京都国分寺市本町２－７－１０エッセンビル２階",139.48337856,35.70139733
"東京都国分寺市本町３－１１－１４－２Ｆ",139.48085649,35.70320540
"東京都国分寺市西恋ケ窪４－３０－３－２Ｆ",139.46344666,35.71003475
"東京都国分寺市東恋ケ窪４－２－２",139.46943792,35.70650475
"東京都国分寺市西元町２－１６－３４ザ・ライオンズ武蔵国分寺公園１２７",139.46865787,35.69523104
"東京都国立市北３－１５－２",139.42952223,35.69940727
"東京都国立市中１－１４－１０",139.44266841,35.69680241
"東京都小平市大沼町２－２－１１",139.49289001,35.73999044
"東京都小平市花小金井１－２１－３",139.51545247,35.72681474
"東京都小平市花小金井１－９－２エスパシオ３０１号",139.51407761,35.72648419
"東京都小平市鈴木町２－２０５",139.50651447,35.72495917
"東京都小平市小川町１－７６６",139.45050252,35.73115967
"東京都小平市小川西町１－２３－１３－１階",139.45338532,35.73748957
"東京都小平市小川西町４－８－１１",139.46249294,35.73512345
"東京都西東京市谷戸町２－１－４１－１Ｆ",139.53724430,35.74319111
"東京都西東京市谷戸町２－１－４１グランドマストひばりが丘南１０３号",139.53724430,35.74319111
"東京都東村山市栄町２－１０－２４",139.47104152,35.75023867
"東京都東村山市本町２－４－６１クレストハイム１Ｆ",139.46701923,35.76128454
"東京都立川市高松町２－３９－１２",139.42175033,35.70835602
"東京都立川市曙町２－１１－２フロム中武７階",139.41483728,35.69974569
"東京都立川市曙町２－３７－７コアシティ立川ビル６Ｆ・９Ｆ",139.41416226,35.70168991
"東京都立川市柴崎町２－１－８第２中島ビル４階",139.41121820,35.69763751
"東京都立川市柴崎町３－１０－２０立川渡辺ビル１Ｆ",139.41210436,35.69469342
"東京都立川市柴崎町３－１－１エキュート立川４階",139.41272084,35.69813194
"東京都立川市柴崎町３－８－２ビルドはなさい５階",139.41214875,35.69595161
"東京都西多摩郡日の出町大久野３１０",139.24630571,35.74287815
"東京都日野市栄町１－３１－９ヴェルジュ１４０　１Ｆ",139.39452576,35.68181946
"東京都八王子市明神町４－３０－２",139.34523058,35.66193186
"東京都八王子市明神町４－８－１",139.34146715,35.65829884
"東京都八王子市本町１３－８",139.33233451,35.66124550
"東京都八王子市南町３－５シュゼル八王子１Ｆ",139.33359839,35.65814033
"東京都八王子市東町１－６橋完ＬＫビル１Ｆ",139.34033671,35.65774054
"東京都八王子市南大沢２－２５フォレストモール南大沢２階",139.38134601,35.61314382
"東京都八王子市南大沢２－２５フォレストモール南大沢２階",139.38134601,35.61314382
"東京都八王子市万町１７５－１クリニックビレッジＤ棟",139.33279316,35.65121610
"東京都八王子市北野町５４５－３きたのタウンビル６Ｆ",139.35477195,35.64543119
"東京都八王子市西片倉３－１－２１第一みなみ野クリニックセンター２Ｆ",139.32977456,35.63413460
"東京都八王子市散田町３－１０－１",139.31323078,35.65551507
"東京都八王子市台町２－１４－２０",139.31787773,35.65200169
"東京都町田市小川２－２５－１４成瀬メディカルヴィレッジ１階",139.47166902,35.53130020
"東京都町田市鶴間３－２－３ＭＱプラザ南町田１階",139.47012282,35.51068143
"東京都町田市原町田１－７－１７ガレリア町田ビル２Ｆ",139.44810096,35.54022562
"東京都町田市原町田４－１４－１４Ｌｉｆｉｘビル２階",139.45043959,35.54231437
"東京都町田市原町田４－１７－１１",139.45194778,35.54314490
"東京都町田市原町田６－２２－１５",139.44918687,35.54353643
"東京都町田市鶴川２－１７－１",139.47434826,35.58790086
"東京都町田市大蔵町３１６５",139.47078445,35.58301177
"東京都昭島市武蔵野２－７－１２",139.37741776,35.72151444
"東京都福生市本町７－１プリマヴェール福生２階",139.32760453,35.73826686
"東京都福生市本町９５－３",139.32660174,35.74033880
"東京都福生市牛浜１１８－１コートエレガンスＥｌｌｅ－Ｋ２Ｆ",139.33354589,35.73524795
"東京都あきる野市草花２７２４",139.29241554,35.74296248
"東京都あきる野市秋川６－５－１",139.29196048,35.72934464
"東京都あきる野市小川東１－１９－２０－１Ｆ",139.32492203,35.71839150
"東京都青梅市新町３－３－１－２Ｆ",139.30307467,35.77826706
"東京都青梅市新町３－５３－５",139.30146633,35.78210823
"東京都狛江市中和泉１－１－１－４階",139.57796492,35.63391331
"東京都狛江市中和泉５－２０－１１",139.56641019,35.64006236
"東京都西東京市北町１－６－１レッツビルディング２Ｆ",139.55928943,35.75306544
"東京都西東京市下保谷４－２－２１",139.56538348,35.74951881
"東京都西東京市東町２－１４－１２",139.56345039,35.74673854
"東京都西東京市東町６－６－１０西東京メディカルモール",139.56561159,35.73947555
"東京都西東京市富士町４－１８－１０",139.56400937,35.72904060
"東京都西東京市東伏見５－９－１４",139.55889620,35.72254677
"東京都東久留米市新川町２－２－２２",139.53999347,35.76068913
"東京都東久留米市東本町４－３",139.53397163,35.76263324
"東京都東久留米市南沢５－１７イオンモール東久留米２階",139.52652843,35.74521564
"東京都東久留米市本町１－３－６グランツビル２Ｆ",139.53274126,35.76035015
"東京都清瀬市元町１－８－３０",139.51994208,35.77363441
"東京都清瀬市松山１－４－１９ＨＲＮビル１・２・３階",139.52048373,35.77114861
"東京都清瀬市松山２－１－３",139.51679799,35.77003200
"東京都清瀬市松山３－１－２４",139.51150403,35.77103731
"東京都羽村市羽４２０７",139.33171713,35.76416117
"東京都羽村市神明台１－３０－５",139.32060730,35.75298158
"東京都羽村市神明台３－４－５",139.32603156,35.76216401
"東京都多摩市貝取１４３１－３",139.44359832,35.63505116
"東京都多摩市貝取１－５２－１ノーブル貝取１Ｆ",139.43766037,35.62446619
"東京都多摩市永山１－４グリナード永山５０４",139.44805926,35.62920755
"東京都多摩市永山１－４グリナード永山５Ｆ",139.44805926,35.62920755
"東京都多摩市落合１－３２－１多摩センターペペリビル５階",139.42793345,35.62416595
"東京都多摩市落合１－３５ライオンズプラザ多摩センター３階",139.42698910,35.62388818
"東京都多摩市落合１－３８マグレブパーキングビル１階",139.42658076,35.62478528
"東京都多摩市鶴牧２－１－１多摩東京海上日動ビル中央館１Ｆ",139.41836494,35.62129939
"東京都多摩市愛宕４－１７－１リエス多摩センター１Ｆ",139.42719169,35.62787659
"東京都稲城市東長沼３１０７－１ピアタウン２１　２階",139.50065820,35.63693707
"東京都稲城市東長沼３１０７－４京王リトナード稲城３Ｆ",139.50016103,35.63655655
"東京都東大和市南街１－３９－９",139.43258979,35.73895829
"東京都東大和市奈良橋６－８８５－１４",139.42467057,35.74781542
"東京都武蔵村山市大南２－３９－１",139.40304516,35.74162122
"東京都武蔵村山市榎３－４０－１５",139.38771862,35.74752847
"東京都武蔵村山市残堀２－１４－１",139.37257006,35.74609766
"神奈川県川崎市川崎区砂子２－２－１０第２園ビル",139.69939841,35.52944995
"神奈川県川崎市川崎区駅前本町１０－５クリエ川崎８Ｆ",139.69943166,35.53195236
"神奈川県川崎市川崎区駅前本町２６－１アトレ川崎８階",139.69721525,35.53093313
"神奈川県川崎市川崎区宮前町５－１",139.70411192,35.52751679
"神奈川県川崎市川崎区池田１－６－３八丁畷京急ビル３Ｆ",139.69177988,35.52311497
"神奈川県川崎市川崎区大島１－５－１４",139.71041697,35.52537251
"神奈川県川崎市川崎区京町１－９－１１大森ビル１Ｆ",139.69498248,35.51782120
"神奈川県川崎市川崎区京町２－８－１７",139.69491031,35.51556040
"神奈川県川崎市川崎区東扇島７８福利厚生センター２Ｆ",139.75863599,35.49627158
"神奈川県川崎市中原区下沼部１８１０－１シティハウス武蔵小杉２Ｆ",139.66340020,35.57281604
"神奈川県川崎市中原区新丸子東１－８２６－１階",139.66346892,35.57995625
"神奈川県川崎市中原区新丸子東３－１３０２",139.65985871,35.57514615
"神奈川県川崎市中原区新丸子東３－１３０２　ららテラス武蔵小杉４Ｆ",139.65985871,35.57514615
"神奈川県川崎市中原区新丸子東３－１３０２　ららテラス武蔵小杉４階",139.65985871,35.57514615
"神奈川県川崎市中原区新丸子町７４５－３",139.66086359,35.58041728
"神奈川県川崎市中原区市ノ坪４４９－３シティタワー武蔵小杉",139.65985062,35.57278832
"神奈川県川崎市中原区苅宿２４－３７",139.66249543,35.56272057
